Date,Titles
28-03-2023,"Tata Motors shares rose 144% from 52-week low, overbought on charts; what’s next? |  Tata Motors shares hit fresh all-time high on demerger plan |  Tata Motors shares hit record high on February sales; check details"
30-03-2023,How a Tata dealership deceitfully sold me a damaged Harrier: What now |  Maruti Suzuki India vs Tata Motors: Which automobile stock can deliver better returns? |  Tata IPL 2023 to Go
31-03-2023,"Tata Motors to demerge passenger, commercial business into two separate listed entities |  Buy Tata Motors, target price Rs 760: Prabhudas Lilladher |  Tata Motors shares jumped 22% in 2023 so far; can they move beyond prior highs to scale Rs 500?"
01-04-2023, Exclusive: Tata Motors brings TCS veteran Rajesh Kannan to drive its future AI and ML initiatives
02-04-2023,Tata Motors announces a 'National Exchange Carnival' for its customers |  Tata's new 1
04-04-2023," Top 7 Car Manufacturers In March 2023, Tata Motors Finally Overtakes Hyundai For Second Spot"
05-04-2023, Top 10 highest-selling cars and SUVs in April 2023: Maruti WagonR to Tata Punch
06-04-2023, Expect PV segment growth to moderate to 5-7% this fiscal: Tata Motors
07-04-2023,"Stocks to watch on July 4, 2023: Kansai Nerolac Paints, Tata Motors, Paras Defence, Motilal Oswal, others"
08-04-2023,"Tata Motors rolls out 300,000th Punch 28 months after launch |  Rs 50 to Rs 235: This Tata group stock turned into a multibagger in three years; buy, sell or hold?"
09-04-2023,"Tata Nexon facelift: What Nomura says on new launch, share price target |  Tata Nexon facelift bookings to open from 4 September 2023 |  Tata Nexon facelift unveiled; bookings to open on September 4"
10-04-2023," Rate-sensitive stocks, Tata Motors, Bajaj Finance, consumption stocks and Valiant Lab among top stocks to t"
11-04-2023,"D-Street Newsmakers: Tata Motors, Zomato, Titan among 10 stocks that were in focus on November 3 |  Haryana company gifts Tata cars to employees before Diwali: Details"
12-04-2023,"Stock recommendations by share market analysts for December 4, 2023: Tata Motors, Bajaj Electricals, SRF, NHPC, Finolex Cables |  Tata Motors share price Today Live Updates : Tata Motors closed today at ₹705 |  Tata Motors: The Mistake that can Cost You a Lot of Money - Profit Hunter by Equitymaster"
13-04-2023, Multibagger stock gained 791% in three years; supplier for Tata Motors might hit fresh high |  Tata Motors share price today: Action in Tata Group auto stock suggests further upside - Check chart pattern
14-04-2023,"Tata Motors in the lead as compact SUV volumes cross 1 million-mark in FY23 |  Tata Motors Announces Price Hike Across Passenger Vehicle Models Starting May 1, 2023 |  Tata Motors Q4 Results 2023: Date, Time, Preview, Expectations, Stock Performance Ahead Of Quarterly Earnings"
15-04-2023,Tata Motors to increase prices of its passenger vehicles from this date
16-04-2023,"Pune News : Tata Motors issues clarification on EV fire incident held at Katraj |  Suryakumar Yadav, Ishan Kishan lead MI to 5 wickets win against KKR at Tata IPL 2023  |  Tata Nexon EV fire in Pune: Unauthorised repair led to short circuit, investigation reveals"
17-04-2023,"Tata Motors to hike prices in India from 17 July |  #DARK TO THE MAX Tata Motors introduces the new Nexon EV MAX #DARK |  Stocks to Watch: Infosys, HDFC Bank, Reliance, Tata Motors, Vodafone Idea "
18-04-2023,"Hot stocks on April 18, 2023: Reliance Industries, Tata Motors, Zomato, Delhivery, and more |  Fundamental Radar: Tata Motors a play on EPV space as well as strong JLR order book |  Tata Altroz CNG launch tomorrow: Expected price, features, specs"
19-04-2023," Tata Motors opens bookings of the Altroz iCNG – India's first Twin Cylinder CNG with Uncompromised Boot space |  Tata Altroz CNG to be launched on April 19, 2023"
20-04-2023,"Hot stocks on April 20, 2023: Tata Motors, Adani Ports, Titan Company, Indigo Paints and more"
21-04-2023, Tata Altroz: Rear seatbelt buckle comes off in 4 pieces! |  Tata Motors gets a new chief strategic officer
22-04-2023,How a Tata dealership deceitfully sold me a damaged Harrier: What now |  All carmakers selling EVs in India: Tata Motors to Mercedes-Benz
23-04-2023,"Highest-selling Tata Motors cars in March 2023: Nexon, Punch lead the way |  Tata Altroz CNG to be launched on April 19, 2023"
24-04-2023,"Tata Motors Serves the Nation's Heroes, Ties Up with Kendriya Police Kalyan Bhandar"
26-04-2023,"Hot stocks on April 26, 2023: Tata Motors, Rallis India, Hindalco, Ipca Labs, and more |  2020 Tata Harrier Automatic : Official Review - Page 116"
27-04-2023, Tata Tigor EV waiting period stands at up to 4 weeks
28-04-2023,Tata Motors did not mock MG Comet EV: Calls viral images ‘distasteful’
29-04-2023," Tata Motors did not mock MG Comet EV, calls viral image ‘distasteful’  |  Tata Motors files a record 158 patents in FY2023"
30-04-2023, 35000 on Tata Safari and Harrier
01-05-2023,"Tata Azura Name Trademarked - Curvv's Production Name? |  Tata Motors, Ashok Leyland among 7 Indian auto stocks to buy as Jefferies sees strong returns in 2023 "
02-05-2023, Tata Motors gears up to increase production with recently acquired Ford India plant
03-05-2023," Tata Motors surpasses 5 million passenger vehicles mark, unveils celebratory campaign"
04-05-2023, Tata Motors appoints Inchcape as the distributor of commercial vehicles in Thailand
05-05-2023," Meet Tata Motors’ backed engineer launching new two-seater EV, Mukesh Ambani is his…"
06-05-2023,"Tata Motors rises to hits 52-week high on Rs 13,000 crore capex plans |  Should You Invest In Tata Motors After 39% Rally YTD ? |  Tata Group to build Rs 13,000 crore EV battery plant in Gujarat: Details"
07-05-2023," Rakesh Jhunjhunwala Birth Anniversary: Aptech, NCC, Tata Motors, Titan, IHCL among Jhunjhunwala multibagger stocks that have outperformed Nifty50 in 1 year"
09-05-2023,12 MWp on-site solar project at Tata Motors' Pune manufacturing facility
10-05-2023,"Tata Motors share price Today Live Updates : Tata Motors closed today at ₹619 |  Tata Motors to equip 50% workforce with new-age auto tech |  Tata Group's upcoming IPO can be next wealth creator for investors, says Ambareesh Baliga"
11-05-2023,"Buy Tata Motors; target of Rs 787: Sharekhan |  Tata Motors offers on Tiago, Tigor, Punch, Altroz, Harrier  |  Tata Altroz 1"
12-05-2023,"Tata Motors launches all-new Intra V70 pickup, Intra V20 Gold pickup and Ace HT+ |  2023 Tata Nexon Facelift Review - Page 24 |  Tata Motors share price Today Live Updates : Tata Motors closed today at ₹708"
13-05-2023, Tata Safari gets discounts of up to Rs
14-05-2023,"Tata Punch crosses two lakh production milestone in 19 months: What makes it special |  Chandrasekaran interview: Tata boss reveals new road map for India's oldest, most iconic conglomerate |  Apple iPhone 15 and 15 Plus to be manufactured in India by Tata Group: Report "
15-05-2023,"Tata Motors Hits 6-Plus-Year High, Shares Up 40% So Far in 2023 on Solid Outlook |  Tata Motors hits over 6-year high; up 40% thus far in 2023 on solid outlook |  Tata Motors share price hits new 52-week high after Q4; 5 key triggers for the stock ahead "
16-05-2023,Reduce Tata Motors; target of Rs 457: HDFC Securities |  JLR: The engine revving up Tata Motors’ profitability 
17-05-2023,"Tata Motors on a roll: Should you ride this home-grown auto major now on D-Street? |  Stocks To Watch: Tata Motors, Pfizer, PVR Inox, HPCL, Kalyan Jewellers, IGL, Adani Stocks, DLF"
18-05-2023,"Hot stocks on May 18, 2023: Tata Motors, SBI, Brightcom Group, Jindal Stainless and more |  Tata Harrier achieves one lakh sales milestone: Here's what makes it successful"
19-05-2023,"IT stocks lift Sensex 300 pts, Nifty up 75 pts; Tata Motors jumps; NTPC lags  |  SC upholds Tata Motors' disqualification by BEST from electric bus tender, junks plea"
20-05-2023, Tata Harrier achieves 1 lakh unit sales milestone
21-05-2023,"UVs take 54% of PV market in April, strong FY2024 opening for Maruti, M&M drives ahead of Tata Motors |  Tata Nexon prices in top 10 cities across India"
22-05-2023,"Tata Altroz sells over 240,000 units since launch four years ago |  Tata Motors disrupts the CNG market with the launch of Altroz iCNG |  Tata Motors launches CNG version of Altroz; price starts at Rs 7"
23-05-2023,"Tata Motors wins order for 50 Magna 13 |  Tata Motors bags order to supply 50 Magna buses for Karnataka inter-city travel |  IT stocks lift Sensex 300 pts, Nifty up 75 pts; Tata Motors jumps; NTPC lags "
24-05-2023,"Hot stocks on May 24, 2023: Adani Power, Vedanta, Adani Green, Tata Motors and more |  Tata Harrier first service: My overall experience with Tata Motors |  Tata Nexon EV facelift spied testing in India"
25-05-2023,"Top gainers, losers May 25: Bajaj Auto, ITC, Tata Motors among most active stocks; check full list here  |  Tata Motors shares get 'Sell' call; UBS says negatives overlooked, cites 3 risks for stock |  UBS downgrades Tata Motors to sell; ups target price to Rs 450 a share"
26-05-2023, Moody's upgrades outlook on Tata Motors to positive
27-05-2023,Tata Motors to build multi-billion pound EV battery plant in UK: Details |  Tata expects CNG models to make up 30% of sales by 2030
28-05-2023,Tata Altroz iCNG vs Altroz petrol: Price and specs comparison
29-05-2023,"Tata Motors shares surge in today's trading session  |  Stocks to watch: Sun Pharma, ONGC, Tata Motors, Adani Wilmar, BBQ Nation"
30-05-2023,Tata Motors closed today at ₹518 |  Tata Altroz: Rear seatbelt buckle comes off in 4 pieces!
31-05-2023,"Tata Motors closed today at ₹526 |  Stocks buzzing on May 31, 2023: KRBL, Torrent Pharma, Tata Motors, Mazagon Dock, others"
01-06-2023,"Tata Motors shares hit record high today; can the rally continue in 2024? |  Tata Motors shares rise most on Sensex, overbought on charts; what’s next? |  Tata Motors shares can cross Rs 900 mark, says brokerage; stock approaches record high"
02-06-2023,Tata Motors aims to operationalise Ford's Sanand plant in 12-18 months |  Tata Motors to beef up production capacity at Sanand plant to 4
03-06-2023,"Pathetic Tata Nexon buying experience  |  Jaguar Land Rover sales jump 33% in UK market, Tata Motors stock climbs"
04-06-2023,"Fire broke out at Fiat India's Ranjangaon plant this week, JV partner Tata Motors assures production not hampered |  Tata Motors overtakes Hyundai as India's second largest car maker in March"
05-06-2023," Tata Tiago EV crosses 10,000 delivery mark in under four months: What makes it successful |  Tata delivers 10000 Tiago EVs in under 4 months"
06-06-2023,"FIRST TRADE: Sensex, Nifty see a muted start; Tata Motors up 1%, IT stocks slip |  Tata Tiago gets discounts of up to Rs"
07-06-2023," Tata Motors, Tata Elxsi, Titan, IHCL among Tata Group stocks that outperformed Nifty50, Sensex so far in 2023; should you buy? See what analysts say"
08-06-2023,"Tata Motors to bolster sales infra as it looks to tap demand for EVs from smaller cities |  Tata Punch CNG vs Maruti Suzuki Fronx CNG: Specs, features, price comparison"
09-06-2023,Delhi charges ahead with 400 Tata Motors Starbus EVs |  Tata Motors share price Today Live Updates : Tata Motors closed today at ₹610
10-06-2023,"Rate-sensitive stocks, Tata Motors, Bajaj Finance, consumption stocks and Valiant Lab among top stocks to t |  All-new Tata Harrier bookings to open from Oct 6: New design, features, expected pricing |  Tata Motor global wholesales rise 7% to 3"
11-06-2023,Standard Chartered Bank drives in financing access for Tata Motors' Passenger Electric Vehicle Dealers |  Broker’s call: Tata Motors (Buy) |  Tata Motors share price Today Live Updates : Tata Motors closed today at ₹645
12-06-2023,"2023 Tata Nexon Facelift Review - Page 24 |  Tata Motors share price Today Live Updates : Tata Motors closed today at ₹722 |  Tata Motors Share Price Target 2023: Time To Buy, Sell or Hold? Stock Up 80 pc YTD"
13-06-2023,"Tata Motors to develop software to control its electric powertrains |  Tata Motors shares at Rs 645? JLR outlook stays bright, says Nuvama |  Tata Motors' JLR poised for strong growth; stock gains 7% in 10 sessions"
14-06-2023,Buy Tata Motors; target of Rs 633: Sharekhan
15-06-2023,"Tata Motors evinces interest in green technology project in Jharkhand |  Maruti Suzuki takes early lead in UV sales in April-May, Mahindra drives ahead of Tata Motors"
16-06-2023,"Hot stocks on June 16, 2023: Tata Motors, Capri Global, D-Mart, Axiscades Technologies and more |  Tata Motors share price Today Live Updates : Tata Motors closed today at ₹569"
17-06-2023, Hyundai Exter dimensions compared with Tata Punch and Maruti Ignis
18-06-2023," Tata Harrier waiting period extends up to 4 weeks |  Tata Group - History, Journey, Companies"
19-06-2023, Car design must be a reflection of where it is from: Tata Motor’s Martin Uhlarik
20-06-2023,"Top gainers, losers today: Tata Motors, HCL Tech, Timken, ZEE, Bajaj twins; check full list here  |  Tata Motors shares hit fresh 52-week high; stock up 48% in 2023 so far; time to book profit or more upside possible?"
21-06-2023, Tata Motors shares trading at seven-year high; can they hit Rs 800 mark?
24-06-2023," Tata Altroz waiting period increases to six weeks |  Tata Altroz sells over 200,000 units in 41 months since launch"
25-06-2023,Tata Motors invites applications for apprenticeship – Apply online
26-06-2023, How is Tata Motors gearing up to face competition?
28-06-2023,Tata Motors share price Today Live Updates : Tata Motors closed today at ₹586 |  Tata Motors shares hit record high after CLSA raises target price
30-06-2023,"Buy Tata Motors, target price Rs 760: Prabhudas Lilladher |  Tata Motors, Titan, IHCL, Tata Communications, Metro Brands, other Jhunjhunwala multibagger stocks that outperformed Nifty, Sensex in 2023"
02-07-2023,"Tata Motors 'Desh ke Trucks' campaign aims to redefine storytelling for commercial vehicles |  My Tata Punch MT: Observations after clocking 10000 kms in 6 months |  Electric car sales: Tata Motors leads with 2,426 EV sales in January 2023"
03-07-2023," Car Sales, Market Share Mar 2023 - Maruti, Hyundai, Tata, Mahindra, Kia, Toyota |  Maruti, Hyundai market share dips in February; Tata Motors, Mahindra register gain: FADA"
04-07-2023,"ev' brings forth Tata Motors' efforts of accelerating the EV  |  Buy Tata Motors; target of Rs 525: Motilal Oswal |  Tata Motors surpasses Hyundai in March 2023 sales, says FADA report "
05-07-2023,"Tata’s Tiago delivery crosses 10,000 in less than four months |  Discounts of up to Rs 35,000 on Tata Harrier, Safari, Altroz in May 2023"
06-07-2023,"Celebrating World Environment Day, Tata Motors introduces 'EVOLVE' – an exclusive customer engagement  |  Auto shares in fast lane; Tata Motors, M&M, Maruti Suzuki hit 52-week highs |  Tata Motors aims to capture PV, EV, CV demand in FY2024 amid growing competition"
07-07-2023,"Tata Motors Share Price Live blog for 07 Jul 2023  |  Tata Motors shares gained 41% in three months; analysts on what is the good level to buy |  Weekly breakout scan: Tata Motors DVR, Glenmark Pharma and 8 other stocks crossed last week's high"
08-07-2023,"Tata Motors joins hands with South Indian Bank, offers exclusive financing program for authorized passenger EV dealers |  Tata Motors to bolster sales infra as it looks to tap demand for EVs from smaller cities |  Tata Motors share price Today Live Updates : Tata Motors closed today at ₹609"
09-07-2023,"New Tata Nexon EV Teased; Debut on September 7, 2023 |  Tata Nexon EV facelift unveil today: Range, expected price, battery |  2023 Tata Nexon"
11-07-2023,"Tata Motors share price Today Live Updates : Tata Motors closed today at ₹645 |  Will Tata Motors Share Hit 1,000 Mark In 1 year? Watch Experts' Take On Tata Motors!"
12-07-2023,Tata Motors and HDFC Bank sign MoU for seamless digital financing solutions |  Tata Motors share price Today Live Updates : Tata Motors closed today at ₹721 |  Tata Motors overtakes Hyundai in Nov '23 as auto industry records highest ever sales
13-07-2023,"Stocks that share market analysts recommended on July 13, 2023: Titan Company, Reliance Industries, Tata Motors, Bharat Electronics"
14-07-2023,"Can Tesla's affordable Indian EVs become a headache for Tata Motors, Mahindra?"
16-07-2023,"Tata Motors to hike prices of PVs from July 17 to offset input costs |  Tata Motors to hike prices of its cars, SUVs from July 17 |  Tata Motors to take a marginal price hike on its passenger vehicles from July 17"
17-07-2023,"Tata Motors To Hike Prices Of Its Cars And SUVs From July 17, 2023 |  Tata Motors to hike prices in India from 17 July |  Tata Motors launches high-performance, technologically advanced range of gensets"
18-07-2023,"Maruti a ‘sell’, and so too Tata Motors now, says Kotak Institutional"
19-07-2023,"Tata Motors shares turn bearish, close lower in four of last five sessions; what’s next? |  Tata Motors share price Today Live Updates : Tata Motors closed today at ₹620 |  Tata Motors to set up EV battery plant for JLR in Britain"
20-07-2023,"Tejas Networks shares rise 7% on winning Rs 7,492-crore order from a Tata Group firm"
21-07-2023,"Tata Motors Share Price Live blog for 21 Jul 2023  |  Stocks in news: Infosys, RIL, Tata Motors, HUL and more"
22-07-2023,"Celebrating World Environment Day, Tata Motors introduces 'EVOLVE' – an exclusive customer engagement  |  Bonus and dividend next week: Sun Pharma, Tata motors to go ex-dividend, V R Films to go ex-bonus  |  Jamshedpur FC Reserves to play Tata Motors in JSA League Premier Division semi-finals on 26 July"
23-07-2023," Tata Motors to Turn Ex-Dividend This Week: Record, Payment Dates?"
24-07-2023,"Tata Motors shares to trade ex-dividend this week; key details |  Tata Motors Q1 preview: JLR performance remains crucial |  Bonus and dividend next week: Sun Pharma, Tata motors to go ex-dividend, V R Films to go ex-bonus "
25-07-2023,"Tata Motors gains 3% on nod for DVR share conversion; soars 88% in 2023 |  Tata Motor announces DVR-ordinary share swap |  Tata Motors Q1 Results Highlights: Total capex for FY24 at Rs 38,000 crore of which JLR's at Rs 30,000 crore, says CFO"
26-07-2023,"Tata Motors zooms 5% to fresh high; DVR shares jump 4% amid EV subsidy buzz |  Tata Motors DVRs may see a gap-up start, says Nuvama |  Tata Motors’ DVR shares surge 12"
27-07-2023,"Stocks that share market analysts recommended on July 27, 2023: Ashok Leyland, ITC, Titagarh Rail Systems, Tata Motors |  Tata Motors share price Today Live Updates : Tata Motors closed today at ₹645"
28-07-2023,"Dividend Stocks: Adani Ports, Tata Motors, 50 others to trade ex-dividend - July 28  |  Tata Motors, Tata Steel, Tata Power, Indian Hotels, TCS shares: Tata stocks that FPIs bought & sold in Q1 |  Large Cap Tata Group Stock Up 55"
29-07-2023,Tata Motors shares to trade ex-dividend this week; key details |  Tata Motors Shares Snap 7-Day Rising Streak on Ex-Dividend Day
30-07-2023, Tata Motors opens new vehicle scrapping facility in Bhubaneswar
31-07-2023,"Recos Updates: Motilal Oswal Financial Services Recommends Tata Motors with Potential Upside of 16 |  Stocks to watch on July 4, 2023: Kansai Nerolac Paints, Tata Motors, Paras Defence, Motilal Oswal, others"
01-08-2023," Tata Punch Images, Punch Interior & Exterior Photos, 360 View, Videos"
02-08-2023,"Tata Motors, Tata Steel, Maruti, L&T, ITC, Jubilant FoodWorks among top stocks to watch today"
04-08-2023,"Tata Motors Group shurgs off global woes, wholesales up 8%  |  Tata Motors registers 8% jump in Jan-Mar quarter group global wholesales |  Tata Motors records 8% jump in Q4 group global wholesales"
05-08-2023,"Tata Motors offering discounts up to Rs 33,000 in May 2023 |  Closing Bell: Sensex gains 710 pts, Nifty settles above 18,250; Tata Motors, IndusInd Bank, Bajaj Finance shine"
06-08-2023,"Hot stocks on June 8, 2023: Tata Motors, Jindal Poly, Suzlon Energy, NIIT and more |  Tata Motors to invest $2 billion, roll out 6-7 passenger vehicles by 2027 |  Tata Tiago"
07-08-2023,"Tata Motors global sales rise 5% in Q1 on the back of 30% surge in JLR volume |  Tata Motors group global sales in first quarter rises by 5 per cent: Report |  2024 Tata Curvv Launch, Bookings And Delivery Timeline"
08-08-2023,Tata Motors shares to trade ex-dividend this week; key details |  Tata does it again: Five stars for new Nexon in Global NCAP crash test |  Tata Motors Shares Snap 7-Day Rising Streak on Ex-Dividend Day
09-08-2023,"Tata Motors unveils 2023 Nexon EV facelift ahead of September 14 launch |  News Updates: 2023 Tata Nexon EV bookings to start on September 9 |  2023 Tata Nexon EV facelift revealed: Major upgrades, longer range and advanced technology "
10-08-2023, Tata Harrier Facelift Expected Price With Logic (2023 Updated)
11-08-2023,Tata Motors shares trading above Rs 600 mark for four months; what should investors do? |  Tata Motors share price Today Live Updates : Tata Motors closed today at ₹642 |  Tata Motors Share Price Live Updates: Tata Motors Sees a 0
12-08-2023,"Tata Motors share price Today Live Updates : Tata Motors closed today at ₹714 |  Making EV Charging More Accessible: Bharat Petroleum and Tata Passenger Electric Mobility collaborate to setup  |  Tata Motors, Federal Bank, Alkem Labs: Trading Strategies for these buzzing stocks"
13-08-2023, Tata sells 1 lakh EVs in India; our top Tata EV stories
14-08-2023,Tata Motors shares to trade ex-dividend this week; key details |  Tata Motors share price Today Live Updates : Tata Motors closed today at ₹607
15-08-2023,"Independence Day 2023: Tata Motors, Grasim among analysts' top 7 picks for next 1 year  |  Tata Altroz diesel ownership: Facing issues since I took delivery"
17-08-2023,Tata Motors share price Today Live Updates : Tata Motors closed today at ₹613
18-08-2023,Tata Motors share price Today Live Updates : Tata Motors closed today at ₹615
19-08-2023, Top 5 Mutual Funds with High Allocation to Tata Stocks
20-08-2023,Ratan Tata recounts confronting gangster who targeted Tata Motors |  Tata Nexon secures 5-star Global NCAP rating under new protocol
21-08-2023, Tata Motors Stocks Live Updates: Tata Motors Sees 0
23-08-2023,Tata Motors share price Today Live Updates : Tata Motors closed today at ₹613
24-08-2023,"Tata Motors share price Today Live Updates : Tata Motors closed today at ₹610 |  Stocks in news: Tata Motors, Coforge, RIL, Torrent Pharma, TVS Motor and more |  CCI junks abuse of dominance plea against Tata Motors, Tata Capital and Tata Motor Finance"
25-08-2023,Tata Motors share price Today Live Updates : Tata Motors closed today at ₹605 |  Tata Nexon facelift launch expected soon: What we know so far
26-08-2023,Tata Motors committed to migrate facilities to zero greenhouse gas emissions by 2045: Executive Dir |  Tata Motors to invest Rs 350 Cr to migrate to zero-emission technology
27-08-2023,Tata Nexon facelift launching soon: What we know so far |  Tata Motors says will become net zero in greenhouse emissions by 2045 |  Tata Motors Commits Rs 350 Cr Investment for Transition to Zero-Emission Technology
28-08-2023,"Tata Motors, Tata Steel, Tata Power: Trading strategies for these 3 Tata group stocks |  Stocks to Watch: RIL, Adani Ent, IDFC First, Zee Entertainment, Tata Motors  |  New Tata Nexon facelift front design leaked: Clearest picture yet"
29-08-2023,"Tata Motors share price Today Live Updates : Tata Motors closed today at ₹606 |  #MoveWithMeaning Tata Passenger Electric Mobility introduces new brand identity |  News Updates: India's Tata Motors, Mahindra and Mahindra gain certificates for production-linked payouts"
30-08-2023," Tata Motors Share Price Today Updates: Tata Motors Sees Slight Decline in Price, Average Daily Volatilit"
31-08-2023,Tata Motors share price Today Live Updates : Tata Motors closed today at ₹601
01-09-2023,"Stocks To Watch: Adani Ports, Tata Motors, ZEEL, BEML, Oil India & More |  Tata Motors commences deliveries of the Ace EV to start a new era in last-mile deliveries"
02-09-2023, Tata Motors delivers 218 Winger veterinary vans to the Government of West Bengal |  Tata Nexon Facelift launch in September 2023
03-09-2023,Tata Motors is up 60% in 2023
04-09-2023,ev' brings forth Tata Motors' efforts of accelerating the EV  | evâ€™ brings forth Tata Motorsâ€™ efforts of accelerating the EV Revolution
05-09-2023,"Tata Motors Shares Hit 52-Week High! 3 Reasons Behind Tata Motors Rally |  Tata Motors Dividend 2023 Announcement Date Fixed - Check Tata Motors Q4 Results 2023 Date And Share Price Tar |  How should you trade in Tata Motors, Bajaj Finance, CSB Bank today"
06-09-2023,"Stocks recommended by share market analysts on June 9, 2023: Tata Motors, Aether Industries, Delhivery, SRF |  Tata Motors launches 'Evolve' customer engagement program to build on EV growth momentum"
08-09-2023,"Tata Motors ties up with Kendriya Police Kalyan Bhandar to offer its range of Passenger Electric Vehicles |  2023 Tata Nexon EV breaks cover |  Tata Motors' massive EV onslaught! New Nexon EV, Harrier, Punch & Curvv launch by early 2024"
09-09-2023,"Tata Motors delivers 181 Winger veterinary vans to the Government of Odisha |  2023 Tata Nexon EV facelift: Expected price, booking amount, features and more"
10-09-2023,"Magenta Mobility, Tata Motors partner to deploy 500 Ace EVs for last-mile deliveries |  Tata Motors share price Today Live Updates : Tata Motors closed today at ₹617"
11-09-2023,"Tata Motors share price Today Live Updates : Tata Motors closed today at ₹649 |  Diwali 2023 picks: BHEL, Tata Motors, L&T, Tata Power among PL's top tech ideas |  Five upcoming cars in India in 2024: Tata Harrier EV, Hyundai Creta facelift and more"
12-09-2023,"2023 Tata Nexon Facelift Review - Page 24 |  Bharat Petroleum, Tata Motors subsidiary ink pact to deploy over 7,000 EV chargers: Details |  Tata’s proposal for setting up an OSAT in Assam to get the green light soon?"
